{
  "authority": "working",
  "contentVersion": "material-drops-v1-draft",
  "dropChanceBasisPoints": 1500,
  "quantityPerSuccess": 10,
  "normalEnemyRolls": 1,
  "bossRolls": 5,
  "chapterGenerationWeights": {
    "1": [1, 0, 0, 0],
    "2": [5, 1, 0, 0],
    "3": [25, 5, 1, 0],
    "4": [125, 25, 5, 1]
  }
}
