{
  "authority": "applied",
  "contentVersion": "progression-rebalance-v1",
  "dropChanceBasisPoints": 1500,
  "quantityPerSuccess": 10,
  "normalEnemyRolls": 1,
  "bossRolls": 5,
  "chapterGenerationWeights": {
    "1": [
      1,
      0,
      0,
      0
    ],
    "2": [
      5,
      1,
      0,
      0
    ],
    "3": [
      25,
      5,
      1,
      0
    ],
    "4": [
      125,
      25,
      5,
      1
    ],
    "5": [
      125,
      25,
      5,
      1
    ],
    "6": [
      125,
      25,
      5,
      1
    ],
    "7": [
      125,
      25,
      5,
      1
    ],
    "8": [
      125,
      25,
      5,
      1
    ],
    "9": [
      125,
      25,
      5,
      1
    ],
    "10": [
      125,
      25,
      5,
      1
    ]
  },
  "chapters": {
    "1": {
      "mode": "GUARANTEED",
      "normalQuantity": 2,
      "bossQuantity": 10,
      "generationWeights": [
        1,
        0,
        0,
        0
      ]
    },
    "2": {
      "mode": "CHANCE",
      "normalQuantity": 10,
      "bossQuantity": 10,
      "generationWeights": [
        5,
        1,
        0,
        0
      ]
    },
    "3": {
      "mode": "CHANCE",
      "normalQuantity": 10,
      "bossQuantity": 10,
      "generationWeights": [
        25,
        5,
        1,
        0
      ]
    },
    "4": {
      "mode": "CHANCE",
      "normalQuantity": 10,
      "bossQuantity": 10,
      "generationWeights": [
        125,
        25,
        5,
        1
      ]
    },
    "5": {
      "mode": "CHANCE",
      "normalQuantity": 10,
      "bossQuantity": 10,
      "generationWeights": [
        125,
        25,
        5,
        1
      ]
    },
    "6": {
      "mode": "CHANCE",
      "normalQuantity": 10,
      "bossQuantity": 10,
      "generationWeights": [
        125,
        25,
        5,
        1
      ]
    },
    "7": {
      "mode": "CHANCE",
      "normalQuantity": 10,
      "bossQuantity": 10,
      "generationWeights": [
        125,
        25,
        5,
        1
      ]
    },
    "8": {
      "mode": "CHANCE",
      "normalQuantity": 10,
      "bossQuantity": 10,
      "generationWeights": [
        125,
        25,
        5,
        1
      ]
    },
    "9": {
      "mode": "CHANCE",
      "normalQuantity": 10,
      "bossQuantity": 10,
      "generationWeights": [
        125,
        25,
        5,
        1
      ]
    },
    "10": {
      "mode": "CHANCE",
      "normalQuantity": 10,
      "bossQuantity": 10,
      "generationWeights": [
        125,
        25,
        5,
        1
      ]
    }
  }
}
